software-name.normalizedForm,version.normalizedForm,publisher.normalizedForm,url.normalizedForm,context
SigmaPlot,10,NA,NA,"We identified 5 broad classes of graph and created 23 exam- ples (5 bar, 5 line, 5 scatter, 3 dot plot, and 5 box and whisker) (Supplementary File 5) in SigmaPlot version 10 using fictitious data and expressed to 3 significant figures, so that the true value for each data point was known; the 'new tool' condition had an additional class of graph, ROC/AUC, for which 4 graphs were created."
G*Power,3.1,NA,NA,"According to post-hoc calculations with G*Power 3.1, achieved power to  detect a medium effect with the current sample was good (.84)."
ImageJ,NA,NA,NA,96-well plates image analysis was performed using ImageJ.
BioNumerics,NA,NA,NA,We recently developed an Alignment & Mutation Analysis tool as an extension library for the BioNumerics software.
RAxML,0.9.0,NA,NA,"Maximum likelihood phylogenetic trees were generated using RAxML (v.0.9.0) with GTR+G substitution model and 1,000 bootstrap replicates."
R package ggpubr,NA,NA,NA,"The gene expressions in normal tissues were downloaded from the Genotype-Tissue Expression (GTEx), and the difference between men and women was explored using the R package ggpubr. 10"
VADR,1.1,NA,NA,"The ORF1ab polyprotein CDS involves a programmed ribosomal frameshift, which VADR is capable of properly annotating."
the,NA,NA,NA,NA
ImageCLEF,2020,NA,NA,"Medical tasks started in 2004 and have in some years been the majority of the tasks in ImageCLEF [18,19]."
iqtree,NA,NA,NA,"and iVar 33 to trim primers and call  variants, then restricted to samples with at least 10-fold coverage of at least 97% (29 kilobases)  of the genome (n=10), and utilized the Nextstrain 34 pipeline to build a phylogenetic tree using  iqtree. 35"
of,NA,NA,NA,NA
exactTest,NA,NA,NA,"After dispersion estimation, we performed exactTest for determining differential expres- sion."
Gviz,NA,NA,NA,"To plot these we took the average from each alignment and plot it using the library Gviz and Bioconductor (Hahne & Ivanek, 2016) in R."
NextClade,NA,Nextstrain,https://www.npmjs.com/package/@,All sequences were evaluated through the command-line version of Nextstrain's NextClade  software (https://www.npmjs.com/package/@neherlab/nextclade)
Excel,NA,Microsoft,NA,"Article  QUANTIFICATION AND STATISTICAL ANALYSIS  Flow cytometry analysis and quantifications were done with Statistical analyses were performed using GraphPad Prism (v7), Microsoft Excel for Mac (v14.7.3),"
the,NA,NA,NA,NA
ClusPro,2.0,NA,www.clusp ro.bu.edu,All MHC structures were energy minimized and MHC-peptide docking simulation was performed using ClusPro v.2.0 [47].
HaGLR,NA,NA,NA,"The HaGLR tool [7] is a Haskell implementation of a GLR parser generator, which was implemented with pedagogic purposes."
FastQC,NA,NA,NA,"The quality of the FASTQ files was checked with FastQC [23] before and after trimming the Illumina adapter sequences from the reads (Cutadapt, integrated with TrimGalore [24])."
Matlab,NA,NA,NA,"Instead of tracing the boundaries of all capillaries, we used Matlab to create a simple point-and-click interface which automatically segmented all stained capillary walls."
ClustalX,2.0.12,NA,NA,"Fifty-nine reference nucleotide sequences and amino acid sequences were downloaded from the GenBank database and aligned together with the ones obtained in this study using ClustalX software version 2.0.12 [26] and the Cobalt Multiple Alignment Tool (http://www.ncbi.nlm.nih.gov/tools/cobalt/) for nucleotide and amino acidic sequences, respectively."
Sparky,NA,NA,NA,"Data were processed in NMRpipe, and the peak in- tensities, extracted using Sparky, were fitted to exponential decays in Relax."
GraphPad Prism,6,NA,NA,The binding data were analysed with GraphPad Prism software.
Prism Graph Pad,8.0,NA,NA,Figures and tables were created in Prism Graph Pad (version 8.0) and Excel (Microsoft).
REDCap,NA,NA,NA," REDCap is a secure, web-based appli- cation designed to support data cap- ture for research studies."
mstate,NA,NA,NA,The associated package to work in these di- rections is 'mstate' is useful for multi-state regression and to get prediction probability.
CLC Genomics,NA,"Qiagen, Inc",NA,"Pairwise  and multiple comparisons were conducted using CLC Genomics  software (Qiagen, Inc)."
SAMtools,NA,NA,NA,"SAMtools is a key bioinformatic tool that provides various  utilities for manipulating alignments in the SAM/BAM format,  including sorting, merging, indexing and generating alignments in a  per-position format (21)."
MEGA,6.06,NA,NA,Phylogenetic trees were visualized in MEGA6.06 [50].
R igraph,1.2.5,NA,NA,"Then, based on the significant cytokine-metabolite correlations in severe patients, weighted, undirected correlation networks were built by R igraph (v1.2.5) package."
Stata,14,NA,NA,Statistical anal- yses and figures were conducted using the Stata 14 and GraphPad Prism 8.
SPSS,25,NA,NA,"Since the standard analytical procedures in traditional statistical package assume that the observations in the data represent a simple random sample from the population of interests, a complex sample procedure in SPSS was used."
Cytoscape,NA,NA,NA,The set enrichment results from camera were graphed in Cytoscape using the Enrichment- Map plugin.
Google Maps API,NA,NA,GoogleMapsAPI,"and Gotti- pati's online tutorial [6], we produced the Google Maps API version of our interactive SHA map."
VERIFY-3D,NA,NA,NA,The refined model of IFNA2 was validated by the VERIFY-3D program and the model of the IFNA2 p.Ala120Thr mutant version based on this.
PyMOL,NA,NA,http://pymol.org,Figures representing the structural features were prepared with UCSF Chimera 60 and PyMOL (http://pymol.org).
JMP Soft- ware,NA,SAS Inc,NA,Data were analyzed with JMP Soft- ware (SAS Inc.).
the,NA,NA,at www.protocols,NA
the,NA,NA,NA,NA
SPSS,19,IBM,NA,"SPSS 19 (IBM, Armonk, NY, USA) was used for the statis- tical analyses."
ArcGIS,10.3,NA,NA,We aimed at identifying malaria clusters and hotspots at the urban-rural geographic scale from the Demographic and Health Survey (DHS) data for households between 2000 and 2015 using ArcGIS for intervention programs.
scikit-learn,NA,NA,NA,"The feature importances were computed by estimating, for each feature, the total normalized reduction, across the Decision Trees in the trained Random Forest, to the variance of the target feature (hence, greater importance values denote a greater contribution to explaining the target variance): this computation was performed via the reference Random Forest implementation provided in the scikit-learn library."
WIZARD,NA,NA,NA,"The potential benefit of applying CAMD techniques is to increase the suc- cess rate of finding new drugs compared to the success rate of em- pirical research: Hardware trends (performance and prices of low-end, mid-range and high-end 3D graphics workstations and optical disk and fiber optic technology); Software trends: (i) growing use of 3D databases (Cambridge Crystallographic Database, Brookhaven Protein Databank, THOR, SMILES, ALADDIN, MACCS-I1 and associated programs such as WIZARD, CONCORD) (ii) merging of statistical and molecular modeling techniques (COMFA) for finding solution to CAMD pro- blems."
Bioedit,NA,NA,NA,The sequences were aligned and adjusted using ClustalW and Bioedit.
ARCGIS,9.3.1,Esri,NA,"Distances between coordinates of patients' home addresses and all animal farms within a 1 km radius were calculated using geographic information system (ARCGIS 9.3.1,"
Google Scholar,NA,NA,NA,"Likewise, Google Scholar was included  in the search strategy trying to retrieve grey literature."
BootScan,NA,NA,NA,"RDP [21], GENECONV [22], BootScan [23], MaxChi [24], Chimaera [20], and SiScan [25] were used for screenings the alignment."
DAVID,NA,NA,NA,Probability calculations in DAVID were performed using a metric very similar to Fisher's exact test.
MEGA,NA,NA,NA,Phylogenetic analysis by MEGA-X also signified the homology of isolated DNA-A (GenBank accession no.
COVIDENCE,NA,NA,NA,"Search results were managed using COVIDENCE software, and duplicates were removed. 39"
Android,NA,NA,NA, MIT app inventor: MIT App Inventor is a web-based visual programming envi- ronment that facilitates designing both the business logic and GUI layout of Android apps.
ScanNeo,NA,NA,NA,"ScanNeo is another prediction computational pipeline based on RNA-seq that aims to identify insertion and deletion derived neo- antigens, which was validated in prostate cancer [172], and ASNEO, which identifies personal-specific alter- native splicing derived neoantigens [173]."
MOLE,2.0,NA,NA,"MOLE 2.0 (Sehnal et  al., 2013) and Caver Web 1.0 (Stourac et al., 2019) were used for advanced analysis of biomacromolecular channels."
BWA-MEM,0.7.17,NA,NA,"using BWA-MEM v. 0.7.17 for single-end reads with default settings (4), and SAM/BAM files were manipulated by SAMtools v. 1.9-11 (5)."
Analyse-it,NA,NA,NA,"Statistical analyses were performed using the Statistical Package for the Social Sciences (SPSS) version 14.0 for Windows (SPSS, Chicago, IL, USA) and Microsoft Excel 2007 with Analyse-it function."
MotionCorr,2,NA,NA,"Raw micrographs were aligned and dose-weighted using MotionCorr2 (Zheng et al., 2017) followed by whole micrograph CTF-collection using GCTF (Zhang, 2016)."
SeuratObject,NA,NA,NA,"Another issue was the prolif- eration of the many di erent and quickly evolving R-based le formats for processing and storing the data, such as  SingleCellExperiment as used by the Scater suite, SCSeq from RaceID, and SeuratObject from Seurat [10, 11]."
MagnaFire SP,2.1B,NA,NA,Tissue sections were photographed with Optronics cam- era attached to Ziess Axioskop 2 plus microscope using the Zeiss Achroplan 20X objective and images were captured using MagnaFire SP 2.1B software.
LogMap,NA,NA,NA,"This is expected as systems like LogMap rely on the semantics of the input ontologies or KGs, which is missing in the input tabular data."
CHOCOLATE,NA,NA,NA,The results also show that CHOCOLATE identifies that A 1 = 2 is a very important value: all points with this value have a high membership degree.
